Дата;Заголовок;Анонс;URL
24 Жовтня;VI Всеукраїнський фестиваль блогерів «Smart Blog»;Кафедра видавничої справи Київського університету імені Бориса Грінченка запрошує взяти участь у VІ Всеукраїнському фестивалі блогерів «SMART BLOG»!;https://knute.edu.ua/blog/read/?pid=43398&uk
29 Жовтня;Круглий стіл «Бізнес та освіта: партнерство в умовах нових викликів»;В межах святкування 75-річчя КНТЕУ 29 жовтня 2021 об 11.;https://knute.edu.ua/blog/read/?pid=43304&uk
04 Листопада;Конкурс кращих практик студентського/курсантського самоврядування м. Києва;Департамент молоді та спорту виконавчого органу Київської міської ради (Київської міської державної адміністрації), за ініціативи Української молодіжної правничою асамблеї, та спільно з Українським координаційним центром з підвищення правової освіти населення,...;https://knute.edu.ua/blog/read/?pid=43399&uk
08 Листопада;KNUTE Career Week-2021;8-12 листопада 2021 року в Київському національному торговельно-економічному університеті відбудеться в режимі ZOOM «KNUTE Career Week-2021».;https://knute.edu.ua/blog/read/?pid=43391&uk
09 Листопада;Науково-практичний студентський круглий стіл «Облік та оподаткування у контексті євроінтеграційних процесів»;09 листопада 2021 року о 10.;https://knute.edu.ua/blog/read/?pid=43397&uk
15 Листопада;IX Всеукраїнський студентський конкурс торговельної реклами;15-19 листопада у межах відзначення 75-річчя Київського національного торговельно-економічного університету та Global Trade Day проходитиме IX Всеукраїнський студентський конкурс торговельної...;https://knute.edu.ua/blog/read/?pid=43341&uk
17 Листопада;Студентська наукова конференція «Фінансова політика в умовах економічних перетворень»;Відповідно до плану заходів у КНТЕУ на 2021 рік, ініціативи кафедр факультету фінансів та обліку 17–18 листопада 2021 р.;https://knute.edu.ua/blog/read/?pid=43370&uk
26 Листопада;IV Всеукраїнський студентський конкурс бізнес-проєктів «Бізнес-трамплін»;Запрошуємо студентів взяти участь у IV Всеукраїнському студентському конкурсі бізнес-проєктів «Бізнес-трамплін». Інформаційний лист;https://knute.edu.ua/blog/read/?pid=43213&uk
